{"counts":{"accessibility":13,"fixture":9,"total":50,"visual":28},"evidenceKind":"hardware-free-native-container-debug-fixture","hero":{"canonicalPixelSHA256":"42fe34fa9add13e9360f3030e2ff6458513dc70857d57b8d04c0ef5203ced332","captureIDHash":"f247128880034697ea41dc8173c0f2bd5a914fb91a50187a1dfd97f63157e776","heroArtifactSHA256":"77bfdc4c2284b16096ca877b44c094576f773d6244e39b1aa738a7186f5d1a89","rowID":"main-1180x820-light","screenshotSHA256":"77bfdc4c2284b16096ca877b44c094576f773d6244e39b1aa738a7186f5d1a89"},"nonClaims":["full-evidence-bundle-not-committed","hardware-compatibility-not-claimed","release-readiness-not-claimed"],"products":{"axCollectorProvenance":{"buildTransactionID":"fde3ee95925161ad2ad44e3d9354880c265f672ebb5868bd0c01638bf35e3097","configuration":"debug","productRole":"ax-collector","schemaID":"https://vifty.app/schemas/ui-review-build-provenance-v1.schema.json","schemaVersion":1,"sourceCommit":"e5b75764fd84c2e0a70c1d7e60a3033fa999df45","sourceTree":"1654ddb3a847bc6ed193e56a9ecff21e611e243b"},"axCollectorProvenanceSHA256":"c51ae68424290cea029916e4f24af8b04b5ca0a7d7ce01a3a9911176ee051748","axCollectorSHA256":"e61b1b57e5c34f7e98414d9279eba7eb06bd70eb46c4a4fd3d2baf4ca154754a","buildTransactionID":"fde3ee95925161ad2ad44e3d9354880c265f672ebb5868bd0c01638bf35e3097","debugFixtureProvenance":{"buildTransactionID":"fde3ee95925161ad2ad44e3d9354880c265f672ebb5868bd0c01638bf35e3097","configuration":"debug","productRole":"debug-fixture-app","schemaID":"https://vifty.app/schemas/ui-review-build-provenance-v1.schema.json","schemaVersion":1,"sourceCommit":"e5b75764fd84c2e0a70c1d7e60a3033fa999df45","sourceTree":"1654ddb3a847bc6ed193e56a9ecff21e611e243b"},"debugFixtureProvenanceSHA256":"c35c40ff8be367f9770a1c7f6dab30712a197d741a8cb0f74b0434ac36bcd54c","debugFixtureSHA256":"e0a424e2b90ae2845695b24855ec88076c3eaa8709e3d70eb06f289c77e03280","releaseExclusionProvenance":{"buildTransactionID":"fde3ee95925161ad2ad44e3d9354880c265f672ebb5868bd0c01638bf35e3097","configuration":"release","productRole":"release-exclusion","schemaID":"https://vifty.app/schemas/ui-review-build-provenance-v1.schema.json","schemaVersion":1,"sourceCommit":"e5b75764fd84c2e0a70c1d7e60a3033fa999df45","sourceTree":"1654ddb3a847bc6ed193e56a9ecff21e611e243b"},"releaseExclusionProvenanceSHA256":"b3e64cf1c2c5e34d5fe8093894ff9e685b4975b5aa523a5d4a09f472281b22fe","releaseExclusionSHA256":"50d264c7f1a6dc6c70a8cf8d67aecdb1e389869216d74a5960474e4dc6ea98a2"},"reviewGates":{"visual":{"claims":[],"priorEvidence":"superseded","status":"pending"},"voiceOver":{"claims":[],"decision":"skipped-by-owner","status":"pending"}},"rows":[{"captureIDHash":"41c4f68dc45593a359373751ba755945f5d9d27411cb597d29fe777ebce865e1","debugBuildProvenanceSHA256":"c35c40ff8be367f9770a1c7f6dab30712a197d741a8cb0f74b0434ac36bcd54c","debugFixtureSHA256":"e0a424e2b90ae2845695b24855ec88076c3eaa8709e3d70eb06f289c77e03280","fixtureReportSHA256":"b506ec4b210d2d3a35990bfb7d492aaf442c1305f4aa7a55d5c9de0b37b0a871","id":"healthy-auto","kind":"fixture","requestSHA256":"b98d552cdad1f859cb12af693cea3259509f804a9b9a69c780b7954912a55db1"},{"captureIDHash":"97c67525938d134d39982c6c277e27a1932f2d2600cf923d55a133acd2cb9032","debugBuildProvenanceSHA256":"c35c40ff8be367f9770a1c7f6dab30712a197d741a8cb0f74b0434ac36bcd54c","debugFixtureSHA256":"e0a424e2b90ae2845695b24855ec88076c3eaa8709e3d70eb06f289c77e03280","fixtureReportSHA256":"6ac3c38800dd6075404b5ec72fa0239a25254d3f4d549fd644fd0ad8f84c3236","id":"divergent-per-fan-curve-draft","kind":"fixture","requestSHA256":"c40244a7207996bfd7d4a20c75467ea519bba3fc710cd0eac417c888d67f2bc7"},{"captureIDHash":"9a1633ac129973f854b57ce1e2f7c365f8203a2c73e89c9d41cf718dea888f15","debugBuildProvenanceSHA256":"c35c40ff8be367f9770a1c7f6dab30712a197d741a8cb0f74b0434ac36bcd54c","debugFixtureSHA256":"e0a424e2b90ae2845695b24855ec88076c3eaa8709e3d70eb06f289c77e03280","fixtureReportSHA256":"a00451a75f06e725ec4ed6cecf8603178b6edf02a87bb882a4befd7aa97141e6","id":"active-manual","kind":"fixture","requestSHA256":"357c7554d9b7565645537f5eeab8e94e954d332fbb15229dcfc9c55e400ae42b"},{"captureIDHash":"916cb5192ce033a1205424848f9e525e21b506425453b148504131aa81b25698","debugBuildProvenanceSHA256":"c35c40ff8be367f9770a1c7f6dab30712a197d741a8cb0f74b0434ac36bcd54c","debugFixtureSHA256":"e0a424e2b90ae2845695b24855ec88076c3eaa8709e3d70eb06f289c77e03280","fixtureReportSHA256":"74f204e33efc98027bd1a431a1815bdd787ace286db32b629aaab28cc0b70ed3","id":"recovery-mixed-ownership","kind":"fixture","requestSHA256":"922dae33cd3e1954f5d29d3edd1d58a66848229dc290c9e6c4e59627c0dac46e"},{"captureIDHash":"49ce202dcfc1933bf604fd2dcb90ac6429aa5cc528b4464c8c59d971f135bb99","debugBuildProvenanceSHA256":"c35c40ff8be367f9770a1c7f6dab30712a197d741a8cb0f74b0434ac36bcd54c","debugFixtureSHA256":"e0a424e2b90ae2845695b24855ec88076c3eaa8709e3d70eb06f289c77e03280","fixtureReportSHA256":"7a87cf5eb6d2ff4ac85c0bce837310bac37ef52ffef220eafbf94d2449898c95","id":"helper-blocked","kind":"fixture","requestSHA256":"266bc5b039931c7d15d938674309f8982d60faba4f17c3b95e798f9750901597"},{"captureIDHash":"ea78a703d1baaa3e6fddc7b8b0aaa23a618af24c31a807286ff77e41d8ed279f","debugBuildProvenanceSHA256":"c35c40ff8be367f9770a1c7f6dab30712a197d741a8cb0f74b0434ac36bcd54c","debugFixtureSHA256":"e0a424e2b90ae2845695b24855ec88076c3eaa8709e3d70eb06f289c77e03280","fixtureReportSHA256":"1c80b0b7da9867215bcf99f9d0d61661119f8486a5693f6434ee2d70b9c89ab7","id":"notification-denied","kind":"fixture","requestSHA256":"33b9aa34cb75aa2f7221410a4529d50d0228729eaad6c8990f6892ea59c7fa86"},{"captureIDHash":"90c262b01bad4055659da7b250a0ce00e635b791d9f95710002ba407dbdfc7a0","debugBuildProvenanceSHA256":"c35c40ff8be367f9770a1c7f6dab30712a197d741a8cb0f74b0434ac36bcd54c","debugFixtureSHA256":"e0a424e2b90ae2845695b24855ec88076c3eaa8709e3d70eb06f289c77e03280","fixtureReportSHA256":"edb77955ef7302a5ccfb1de20a125ef2324be160ae9408d36f8831d51c33322c","id":"edited-profile","kind":"fixture","requestSHA256":"17c3ec7261f8c10e2c607a9049642417406fb500ef3bf65141f1b30504456a07"},{"captureIDHash":"c7212bf630315869f29143037b4d53adc9859990c8fd912da5317c05d635f32d","debugBuildProvenanceSHA256":"c35c40ff8be367f9770a1c7f6dab30712a197d741a8cb0f74b0434ac36bcd54c","debugFixtureSHA256":"e0a424e2b90ae2845695b24855ec88076c3eaa8709e3d70eb06f289c77e03280","fixtureReportSHA256":"a2362138b6f97cd3b3320a37be0acef2a62bc2f9e80e1b7ad25138c50e25aee6","id":"selected-vs-highest-temperature","kind":"fixture","requestSHA256":"4a103f7896f25e5db1c8c154a9d5bd7f80b031b0b395f4fd4457e34456624e33"},{"captureIDHash":"cf0d62119b921b09c95f195ad861ba921c5c28683dbed4bacbd12602469c717c","debugBuildProvenanceSHA256":"c35c40ff8be367f9770a1c7f6dab30712a197d741a8cb0f74b0434ac36bcd54c","debugFixtureSHA256":"e0a424e2b90ae2845695b24855ec88076c3eaa8709e3d70eb06f289c77e03280","fixtureReportSHA256":"e9b0dc57112ef7fc1d7c9bda552c2bbaf6c8d998417c837f91274750eca63cfa","id":"raw-spike-telemetry","kind":"fixture","requestSHA256":"cb850ba1eb313e2daafa9263efe5e3b3eaceda51dd4dd8a56e6725d085fd2fa7"},{"canonicalPixelSHA256":"44a961ff9935cf468019254f76c39862d812c7d71174d3748efa3203c8be521c","captureIDHash":"584c26f2f93e49ca9e2bb030a27d1f922dcd36bacec7e52c49d7252a0e3b3202","debugBuildProvenanceSHA256":"c35c40ff8be367f9770a1c7f6dab30712a197d741a8cb0f74b0434ac36bcd54c","debugFixtureSHA256":"e0a424e2b90ae2845695b24855ec88076c3eaa8709e3d70eb06f289c77e03280","fixtureReportSHA256":"b7ef6f052dcab44d4167d9a67d993a3456bf03679e6de25672d8e425b1a7937b","id":"main-780x480-light","kind":"visual","requestSHA256":"6343f043c95507a0bf3bca03d4b2640882f1da998b7c760d51420815137ad42c","screenshotSHA256":"f1253ee10af457505d294b8560de2bbf2c4e72c8a659578aa3a996c4e75c84bb"},{"canonicalPixelSHA256":"461d62e06ad3f3de2bdd4e988ef4f9bbfffbaf13bf0a3062a0ad77aa4043d813","captureIDHash":"3e2d4d9dd4d0dd5362a0eceb01d5ab51a76670e736a7d598399c9bf59198f172","debugBuildProvenanceSHA256":"c35c40ff8be367f9770a1c7f6dab30712a197d741a8cb0f74b0434ac36bcd54c","debugFixtureSHA256":"e0a424e2b90ae2845695b24855ec88076c3eaa8709e3d70eb06f289c77e03280","fixtureReportSHA256":"ba67848e4b062922534e740533a107784745534b5811c1a3ae0c85bcc1ddfd9e","id":"main-780x480-dark","kind":"visual","requestSHA256":"7a7a94aba066bc74a0a4d39bd907c4a967b151e3d32ea5406bdc9b0bc1a10791","screenshotSHA256":"2ce957137af73fac6755b0d8d0235b61c30de00176ef7877ce0371a385037def"},{"canonicalPixelSHA256":"42fe34fa9add13e9360f3030e2ff6458513dc70857d57b8d04c0ef5203ced332","captureIDHash":"f247128880034697ea41dc8173c0f2bd5a914fb91a50187a1dfd97f63157e776","debugBuildProvenanceSHA256":"c35c40ff8be367f9770a1c7f6dab30712a197d741a8cb0f74b0434ac36bcd54c","debugFixtureSHA256":"e0a424e2b90ae2845695b24855ec88076c3eaa8709e3d70eb06f289c77e03280","fixtureReportSHA256":"bba728b9059726ee7671860d50225e26888c69e750cd818b97d4e1d921687c84","id":"main-1180x820-light","kind":"visual","requestSHA256":"b98d552cdad1f859cb12af693cea3259509f804a9b9a69c780b7954912a55db1","screenshotSHA256":"77bfdc4c2284b16096ca877b44c094576f773d6244e39b1aa738a7186f5d1a89"},{"canonicalPixelSHA256":"b17b4791855d949a0590d0dd845fd620060df9f07be26ed9449ba66158e3eeaf","captureIDHash":"49b3b365cb3ded052cbc8f9cfb009c233daf12a0b4a5b1a15fb46302351f66a9","debugBuildProvenanceSHA256":"c35c40ff8be367f9770a1c7f6dab30712a197d741a8cb0f74b0434ac36bcd54c","debugFixtureSHA256":"e0a424e2b90ae2845695b24855ec88076c3eaa8709e3d70eb06f289c77e03280","fixtureReportSHA256":"a9a3e41795ad7201a93970d5bab1e99865b73616c8c1b7033de36068a65c75a6","id":"main-1180x820-dark","kind":"visual","requestSHA256":"0df86b8f7a07fa1e934a40ad455b217aeafc3960e918904434292a7a2bdd8b91","screenshotSHA256":"2d7874f72dda5b2d54c2a50034196e08e3e2c17f69d2bf718269cea9bd830e41"},{"canonicalPixelSHA256":"78d94c452296027f2c64ad1af5b3d1bbeb3180c579d642887a3fdc108eee479a","captureIDHash":"bed8548a289b0a56005861c7f834b31b36c881a943d61339dde04efeeabc695c","debugBuildProvenanceSHA256":"c35c40ff8be367f9770a1c7f6dab30712a197d741a8cb0f74b0434ac36bcd54c","debugFixtureSHA256":"e0a424e2b90ae2845695b24855ec88076c3eaa8709e3d70eb06f289c77e03280","fixtureRe